{
  "$schema": "./konsilio.schema.json",
  "personas": {
    "enabled": ["performance", "typescript", "devops"],
    "_comment": "Available personas: security, performance, ux-dx, devops. Remove any you don't want."
  },
  "models": {
    "experts": "google/gemini-2.5-flash-lite",
    "lead": "google/gemini-2.5-pro",
    "debate": "google/gemini-2.5-flash-lite"
  },
  "timeouts": {
    "expertMs": 90000,
    "leadMs": 120000,
    "debateMs": 60000
  },
  "maxDraftPlanLength": 12000,
  "maxHistorySessions": 10,
  "databasePath": "./data/council.db"
}